<?xml version="1.0" encoding="UTF-8"?>
<xs:schema xmlns:xs="http://www.w3.org/2001/XMLSchema">

  <!-- Root element -->
  <xs:element name="hotels">
    <xs:complexType>
      <xs:sequence>
        <xs:element name="hotel" maxOccurs="unbounded">
          <xs:complexType>
            <xs:sequence>
              <xs:element name="name" type="xs:string"/>
              <xs:element name="description" type="xs:string"/>
              <xs:element name="rooms">
                <xs:complexType>
                  <xs:sequence>
                    <xs:element name="room" maxOccurs="unbounded">
                      <xs:complexType>
                        <xs:attribute name="id" type="xs:string" use="required"/>
                        <xs:attribute name="type" type="xs:string" use="required"/>
                        <xs:attribute name="price" type="xs:decimal" use="required"/>
                        <xs:attribute name="status" use="required">
                          <xs:simpleType>
                            <xs:restriction base="xs:string">
                              <xs:enumeration value="Available"/>
                              <xs:enumeration value="Booked"/>
                            </xs:restriction>
                          </xs:simpleType>
                        </xs:attribute>
                      </xs:complexType>
                    </xs:element>
                  </xs:sequence>
                </xs:complexType>
              </xs:element>
            </xs:sequence>
            <xs:attribute name="id" type="xs:string" use="required"/>
          </xs:complexType>
        </xs:element>
      </xs:sequence>
    </xs:complexType>
  </xs:element>

</xs:schema>